Tool,Meta Title,Meta Description,LSI Keywords,FAQ Questions
"Basic Calculator","Basic Calculator - Quick Online Arithmetic","Basic Calculator to solve everyday arithmetic quickly. Use this online calculator for sums, differences, products and quotients.","online calculator;arithmetic calculator;simple calculator","How do I use the Basic Calculator?;Is this calculator free?;Can I use it offline?;Does it handle negative numbers?;Is my data saved?"
"Scientific Calculator","Scientific Calculator - Advanced Functions Online","Scientific Calculator with trigonometry and exponent features for complex math.","online scientific calculator;advanced functions","What functions are supported?;Is it free?;Does it work offline?;Can I use it on mobile?;Is history saved?"
"Word Counter","Word Counter - Count Words Instantly","Word Counter counts words and characters instantly in your text.","word counter online;text length checker","How do I use Word Counter?;Is there a character limit?;Can I paste text?;Does it work offline?;Is data stored?"
"Random Number Generator","Random Number Generator - Pick a Number","Random Number Generator to quickly select a number within a range.","online number picker;random number tool","How do I generate numbers?;Can I set min and max?;Is it free?;Does it work offline?;Any limits?"
"Graphing Calculator","Graphing Calculator - Plot Mathematical Functions","Graphing Calculator plots mathematical functions in real time. Visualize equations with this online graphing tool.","online graphing calculator;plot equations;function graphing","How do I graph a function?;Is the Graphing Calculator free?;Does it work offline?;Can I plot multiple functions?;Is it mobile friendly?"
"Unit Converter","Unit Converter - Convert Units Easily","Unit Converter helps you switch between metric and imperial measurements instantly.","online unit converter;metric to imperial;measurement conversion","How do I change units?;Is there a cost?;Does it work offline?;What units are supported?;Can I use it on mobile?"
"Tip Calculator","Tip Calculator - Split Restaurant Bills Easily","Tip Calculator computes service gratuity and splits bills so you always know what to pay when dining out.","restaurant tip;bill splitting;service gratuity","How does the Tip Calculator work?;Is it suitable for group dining?;Can it handle custom tip rates?;Does it store my data?;Will it work offline?"
"Percentage Calculator","Percentage Calculator - Find Percent Values Quickly","Percentage Calculator helps you compute percent values and percent changes with ease.","percentage increase;percent of number;percent change","How do I calculate a percentage?;Can it find percentage increase?;Does it work offline?;Is my data stored anywhere?;Is it free to use?"
"Discount Calculator","Discount Calculator - Save Money on Purchases","Discount Calculator quickly shows the sale price and savings from any discount.","discount calculator online;price after discount;percentage off","How do I use the Discount Calculator?;Can I enter any percent off?;Does it work offline?;Will it show how much I save?;Is it free to use?"
"Temperature Converter","Temperature Converter - Switch Celsius and Fahrenheit","Temperature Converter quickly converts between Celsius and Fahrenheit.","celsius to fahrenheit;fahrenheit to celsius;online temperature converter","How do I convert Celsius to Fahrenheit?;Can it convert Fahrenheit to Celsius?;Does it work offline?;Is there any cost?;Is my data stored?"
"Age Calculator","Age Calculator - Find Your Exact Age","Age Calculator now shows years, months and days from your birth date.","age calculator online;how old am i;birthday calculator","How do I calculate my age?;Is the Age Calculator free?;Does it work offline?;Is my birthdate stored?;Can I calculate someone else's age?"
"BMI Calculator","BMI Calculator - Check Body Mass Index Fast","BMI Calculator categorizes your BMI after calculation for extra guidance.","body mass index;online bmi calculator;health bmi","How do I use the BMI Calculator?;Is this calculator free?;Are my numbers saved?;What units are supported?;What is a healthy BMI range?"
"Date Difference Calculator","Date Difference Calculator - Days Between Dates","Date Difference Calculator shows days between two dates quickly.","days between dates;date duration calculator;online day counter","How do I find days between two dates?;Can it handle future dates?;Is it free?;Does it work offline?;Is my data kept private?"
"Fraction Calculator","Fraction Calculator - Work with Fractions Fast","Fraction Calculator lets you add, subtract, multiply, and divide fractions instantly. Use this online fraction solver for homework or recipes.","online fraction calculator;fraction solver;simplify fractions","How do I add fractions?;Can I multiply fractions?;Does it reduce fractions?;Will it work offline?;Is my input stored anywhere?"
"Simple Interest Calculator","Simple Interest Calculator - Estimate Loan Interest Fast","Simple Interest Calculator finds interest from principal, rate and time quickly.","simple interest formula;loan interest;investment interest","How do I calculate simple interest?;Can it handle months?;Is this calculator free?;Does it store numbers?;Can I use it on mobile?"
"Compound Interest Calculator","Compound Interest Calculator - Grow Savings Over Time","Compound Interest Calculator shows how savings or loans grow when interest compounds.","compound interest formula;investment growth;interest calculator","How is compound interest calculated?;Can I see the final balance?;Is this tool free?;Does it support monthly compounding?;Are my inputs saved anywhere?"
"Loan Calculator","Loan Calculator - Estimate Monthly Payments","Loan Calculator computes monthly mortgage or loan payments so you can plan your budget.","loan calculator online;mortgage estimator;monthly payment","How do I calculate my loan payment?;Can I use this for mortgages?;Does it work offline?;Is my data saved?;Is the tool free?"
"Time Zone Converter","Time Zone Converter - Compare World Times","Time Zone Converter quickly shows the time in another city so you can plan meetings across the world.","time zone converter;world clock;meeting planner","How do I convert times?;Does it work offline?;Can I search for cities?;Is daylight saving handled?;Is it free to use?"
"Countdown Timer","Countdown Timer - Track Time Remaining","Countdown Timer lets you set a duration and watch the seconds tick down on any device.","online timer;countdown clock;productivity timer","How do I start the timer?;Can I pause it?;Does it work offline?;Will it alert me?;Is it free?"
"BMR Calculator","BMR Calculator - Estimate Calorie Needs","BMR Calculator quickly estimates your basal metabolic rate to plan daily calories.","basal metabolic rate;bmr equation;calorie calculator","How do I calculate BMR?;Which formula is used?;Does it work offline?;Are my numbers stored?;Can I switch units?"
"Currency Converter","Currency Converter - Quick Exchange Rates","Currency Converter adds JPY support while still working fully offline.","currency exchange;usd to eur;offline currency converter","How do I convert currencies?;Are rates live?;Can I add more currencies?;Is it free to use?;Does it work offline?"
"Stopwatch","Stopwatch - Measure Time Precisely","Stopwatch for accurate time tracking with start, stop and reset controls.","online stopwatch;time tracker;stopwatch timer","How do I start the stopwatch?;Can I use keyboard shortcuts?;Does it work offline?;Is data stored anywhere?;Is it free?"
"UUID Generator","UUID Generator - Create Unique Identifiers","UUID Generator makes version 4 IDs for coding and database tasks.","uuid generator online;create uuid;unique identifier","How do I generate a UUID?;Is it version 4?;Can I copy the ID?;Does it work offline?;Is it free?"
"JSON Formatter","JSON Formatter - Beautify JSON Data","JSON Formatter cleans and indents raw JSON text for easy reading.","format json online;json beautifier;parse json","How do I format JSON?;Is invalid JSON detected?;Does it work offline?;Can I copy results?;Is it free?"
"CSV to JSON Converter","CSV to JSON Converter - Transform Data Easily","CSV to JSON Converter changes comma-separated values into structured JSON.","csv to json online;convert csv;spreadsheet to json","How do I convert CSV?;Are headers required?;Does it handle quotes?;Does it work offline?;Is it free?"
"Circle Area Calculator","Circle Area Calculator - Find Disk Size Fast","Circle Area Calculator finds the area of a circle instantly from any radius or diameter.","circle area;disk area calculator;radius to area","How do I calculate circle area?;Can I input diameter?;Does it work offline?;Is it free?;Are my numbers stored?"
"Triangle Area Calculator","Triangle Area Calculator - Find Triangle Size Fast","Triangle Area Calculator quickly finds area from base and height.","triangle area calculator online;base and height;geometry","How do I find triangle area?;Can I use different units?;Does it work offline?;Is it free?;Is my input saved?"
"Epoch Time Converter","Epoch Time Converter - Unix Timestamp Tool","Epoch Time Converter changes regular dates into Unix timestamps and back in an instant.","unix time converter;timestamp converter;epoch to date","How do I convert to Unix time?;Can I convert from a timestamp?;Does it require internet?;Is my input stored?;Is it free?"
"Paint Coverage Calculator","Paint Coverage Calculator - Estimate Gallons Needed","Paint Coverage Calculator shows how many gallons you need for any room or project.","paint estimator;paint coverage;gallon calculator","How do I use the Paint Coverage Calculator?;Does it account for multiple coats?;Is it free?;Are my values saved?;Can I change units?"
"Color Converter","Color Converter - HEX to RGB and HSL","Color Converter translates HEX color codes to RGB and HSL values instantly.","hex to rgb;color code converter;hsl converter","How do I convert HEX to RGB?;Can it convert to HSL?;Does it work offline?;Is my color saved?;Is it free to use?"
"Base64 Encoder/Decoder","Base64 Encoder/Decoder - Convert Text Quickly","Base64 Encoder/Decoder transforms text to base64 and back instantly in your browser.","base64 encode;base64 decode;text converter","How do I encode text?;Can I decode a base64 string?;Is it secure?;Does it work offline?;Is it free?"
"Body Fat Calculator","Body Fat Calculator - Estimate Percentage Quickly","Body Fat Calculator estimates body fat from simple measurements.","body fat percentage calculator;fitness tracker;body fat estimate","How do I measure body fat?;Is this tool free?;Can I use metric units?;Is data saved?;Does it work offline?"
"Pomodoro Timer","Pomodoro Timer - Boost Focus in 25-Minute Sessions","Pomodoro Timer now includes pause and reset options for flexible sessions.","pomodoro technique;focus timer;productivity tool","How do I start a Pomodoro?;Can I change the timer length?;Does it work offline?;Will it alert me?;Is my data saved?"
"Color Picker","Color Picker - Copy HEX, RGB and HSL","Color Picker displays color codes instantly for designers.","color palette;hex picker;rgb hsl","How do I copy a color code?;What formats are supported?;Does it work offline?;Is my color saved?;Is it free?"
"Dice Roller","Dice Roller - Roll Virtual Dice Instantly","Dice Roller generates random dice results with animation.","virtual dice;random dice app;dice roller","How do I roll the dice?;Can I roll multiple dice?;Does it work offline?;Is my result stored?;Is it free?"
"Markdown Editor","Markdown Editor - Write Markdown with Live Preview","Markdown Editor converts Markdown to HTML in real time.","online markdown editor;live preview;markdown to html","How do I use the Markdown Editor?;Does it save my text?;Can I copy the HTML?;Is it free?;Will it work offline?"
"Car Loan Calculator","Car Loan Calculator - Estimate Payments with Down Payment","Car Loan Calculator factors a down payment for accurate auto budgeting.","car loan payment;auto finance calculator;vehicle loan","How do I include a down payment?;What interest formula is used?;Can I adjust the term?;Does it store data?;Is it free to use?"
"Fuel Cost Calculator","Fuel Cost Calculator - Estimate Trip Fuel Expense","Fuel Cost Calculator computes fuel costs from distance, price and MPG.","fuel cost estimator;trip fuel calculator;gas expense","How is fuel cost calculated?;Can I input kilometers?;Does it support diesel?;Will it work offline?;Is my data stored?"







